{
  "owner_id": "10000000-0000-4000-8000-000000000001",
  "action_id": "10000000-0000-4000-8000-000000000001",
  "tool_id": "calendar.event.create",
  "tool_version": "1",
  "arguments": {
    "calendar_id": "10000000-0000-4000-8000-000000000001",
    "title": "Synthetic study session",
    "start_at": "2030-01-01T10:00:00Z",
    "end_at": "2030-01-01T11:00:00Z",
    "timezone": "UTC",
    "attendees": []
  },
  "policy_revision": "m0-v1",
  "security_epoch": 0,
  "max_executions": 1,
  "max_cost_usd_micro": 0,
  "issued_at": "2030-01-01T00:00:00Z",
  "expires_at": "2030-01-01T00:10:00Z"
}
